{
  "$schema": "../schema/lib.schema.json",
  "name": "brazilian-utils-ruby",
  "language": "ruby",
  "repo": "https://github.com/brazilian-utils/ruby",
  "entry": "lib",
  "options": { "namespace": "BrazilianUtils" },
  "ignore": ["*.sieve", "*.display", "*.validate", "Months.*", "*remove*symbols*"],
  "site": {
    "label": "Ruby",
    "order": 4,
    "package": "br-utils",
    "install": "gem install br-utils",
    "registry": "https://rubygems.org/gems/br-utils",
    "usage": { "ref": "latest-release", "path": "docs/usage" }
  }
}
